<?xml version="1.0"?>
<!DOCTYPE items [
<!ELEMENT items (item*)>
<!ATTLIST items burpVersion CDATA "">
<!ATTLIST items exportTime CDATA "">
<!ELEMENT item (time, url, host, port, protocol, method, path, extension, request, status, responselength, mimetype, response, comment)>
<!ELEMENT time (#PCDATA)>
<!ELEMENT url (#PCDATA)>
<!ELEMENT host (#PCDATA)>
<!ATTLIST host ip CDATA "">
<!ELEMENT port (#PCDATA)>
<!ELEMENT protocol (#PCDATA)>
<!ELEMENT method (#PCDATA)>
<!ELEMENT path (#PCDATA)>
<!ELEMENT extension (#PCDATA)>
<!ELEMENT request (#PCDATA)>
<!ATTLIST request base64 (true|false) "false">
<!ELEMENT status (#PCDATA)>
<!ELEMENT responselength (#PCDATA)>
<!ELEMENT mimetype (#PCDATA)>
<!ELEMENT response (#PCDATA)>
<!ATTLIST response base64 (true|false) "false">
<!ELEMENT comment (#PCDATA)>
]>
<items burpVersion="2023.5.3" exportTime="Mon Jul 10 11:58:13 WIB 2023">
  <item>
    <time>Mon Jul 10 11:57:15 WIB 2023</time>
    <url><![CDATA[https://www.its.ac.id/search-result/?mssearch=aaaaa&msp=1&mswhere=all]]></url>
    <host ip="103.94.189.5">www.its.ac.id</host>
    <port>443</port>
    <protocol>https</protocol>
    <method><![CDATA[GET]]></method>
    <path><![CDATA[/search-result/?mssearch=aaaaa&msp=1&mswhere=all]]></path>
    <extension>null</extension>
    <request base64="true"><![CDATA[R0VUIC9zZWFyY2gtcmVzdWx0Lz9tc3NlYXJjaD1hYWFhYSZtc3A9MSZtc3doZXJlPWFsbCBIVFRQLzEuMQ0KSG9zdDogd3d3Lml0cy5hYy5pZA0KQ29va2llOiBwbGxfbGFuZ3VhZ2U9ZW47IF9nYV84Q1A4UFc1WVdSPUdTMS4xLjE2ODg5NjUwMjYuMS4wLjE2ODg5NjUwMjYuMC4wLjA7IF9nYT1HQTEuMy4xODA4NjIzMDMyLjE2ODg5NjUwMjY7IF9naWQ9R0ExLjMuMTI3NjU0NjI4NC4xNjg4OTY1MDI3OyBfZ2F0X2d0YWdfVUFfNDc2MTc2ODZfMT0xOyBwdmNfdmlzaXRzXzFbMF09MTY4OTA1MTQyN2IzMTQ1OQ0KU2VjLUNoLVVhOiANClNlYy1DaC1VYS1Nb2JpbGU6ID8wDQpTZWMtQ2gtVWEtUGxhdGZvcm06ICIiDQpVcGdyYWRlLUluc2VjdXJlLVJlcXVlc3RzOiAxDQpVc2VyLUFnZW50OiBNb3ppbGxhLzUuMCAoV2luZG93cyBOVCAxMC4wOyBXaW42NDsgeDY0KSBBcHBsZVdlYktpdC81MzcuMzYgKEtIVE1MLCBsaWtlIEdlY2tvKSBDaHJvbWUvMTE0LjAuNTczNS4xMTAgU2FmYXJpLzUzNy4zNg0KQWNjZXB0OiB0ZXh0L2h0bWwsYXBwbGljYXRpb24veGh0bWwreG1sLGFwcGxpY2F0aW9uL3htbDtxPTAuOSxpbWFnZS9hdmlmLGltYWdlL3dlYnAsaW1hZ2UvYXBuZywqLyo7cT0wLjgsYXBwbGljYXRpb24vc2lnbmVkLWV4Y2hhbmdlO3Y9YjM7cT0wLjcNClNlYy1GZXRjaC1TaXRlOiBzYW1lLW9yaWdpbg0KU2VjLUZldGNoLU1vZGU6IG5hdmlnYXRlDQpTZWMtRmV0Y2gtVXNlcjogPzENClNlYy1GZXRjaC1EZXN0OiBkb2N1bWVudA0KUmVmZXJlcjogaHR0cHM6Ly93d3cuaXRzLmFjLmlkLw0KQWNjZXB0LUVuY29kaW5nOiBnemlwLCBkZWZsYXRlDQpBY2NlcHQtTGFuZ3VhZ2U6IGVuLVVTLGVuO3E9MC45DQpDb25uZWN0aW9uOiBjbG9zZQ0KDQo=]]></request>
    <status></status>
    <responselength></responselength>
    <mimetype></mimetype>
    <response base64="true"></response>
    <comment></comment>
  </item>
  <item>
    <time>Mon Jul 10 11:57:11 WIB 2023</time>
    <url><![CDATA[https://www.its.ac.id/wp-content/themes/ITS/assets/fonts/its/AvenirNextLTPro-DemiIt.woff2]]></url>
    <host ip="103.94.189.5">www.its.ac.id</host>
    <port>443</port>
    <protocol>https</protocol>
    <method><![CDATA[GET]]></method>
    <path><![CDATA[/wp-content/themes/ITS/assets/fonts/its/AvenirNextLTPro-DemiIt.woff2]]></path>
    <extension>woff2</extension>
    <request base64="true"><![CDATA[R0VUIC93cC1jb250ZW50L3RoZW1lcy9JVFMvYXNzZXRzL2ZvbnRzL2l0cy9BdmVuaXJOZXh0TFRQcm8tRGVtaUl0LndvZmYyIEhUVFAvMS4xDQpIb3N0OiB3d3cuaXRzLmFjLmlkDQpDb29raWU6IHBsbF9sYW5ndWFnZT1lbjsgX2dhXzhDUDhQVzVZV1I9R1MxLjEuMTY4ODk2NTAyNi4xLjAuMTY4ODk2NTAyNi4wLjAuMDsgX2dhPUdBMS4zLjE4MDg2MjMwMzIuMTY4ODk2NTAyNjsgX2dpZD1HQTEuMy4xMjc2NTQ2Mjg0LjE2ODg5NjUwMjc7IF9nYXRfZ3RhZ19VQV80NzYxNzY4Nl8xPTE7IHB2Y192aXNpdHNfMVswXT0xNjg5MDUxNDI3YjMxNDU5DQpTZWMtQ2gtVWE6IA0KT3JpZ2luOiBodHRwczovL3d3dy5pdHMuYWMuaWQNClNlYy1DaC1VYS1Nb2JpbGU6ID8wDQpVc2VyLUFnZW50OiBNb3ppbGxhLzUuMCAoV2luZG93cyBOVCAxMC4wOyBXaW42NDsgeDY0KSBBcHBsZVdlYktpdC81MzcuMzYgKEtIVE1MLCBsaWtlIEdlY2tvKSBDaHJvbWUvMTE0LjAuNTczNS4xMTAgU2FmYXJpLzUzNy4zNg0KU2VjLUNoLVVhLVBsYXRmb3JtOiAiIg0KQWNjZXB0OiAqLyoNClNlYy1GZXRjaC1TaXRlOiBzYW1lLW9yaWdpbg0KU2VjLUZldGNoLU1vZGU6IGNvcnMNClNlYy1GZXRjaC1EZXN0OiBmb250DQpSZWZlcmVyOiBodHRwczovL3d3dy5pdHMuYWMuaWQvd3AtY29udGVudC90aGVtZXMvSVRTL2Fzc2V0cy9jc3Mvc3R5bGUuY3NzP3Zlcj0xLjAuMQ0KQWNjZXB0LUVuY29kaW5nOiBnemlwLCBkZWZsYXRlDQpBY2NlcHQtTGFuZ3VhZ2U6IGVuLVVTLGVuO3E9MC45DQpDb25uZWN0aW9uOiBjbG9zZQ0KDQo=]]></request>
    <status>200</status>
    <responselength>33295</responselength>
    <mimetype></mimetype>
    <response base64="true"><![CDATA[SFRUUC8xLjEgMjAwIE9LDQpTZXJ2ZXI6IG5naW54LzEuMTAuMw0KRGF0ZTogTW9uLCAxMCBKdWwgMjAyMyAwNDo1NzoxMyBHTVQNCkNvbnRlbnQtVHlwZTogZm9udC93b2ZmMg0KQ29udGVudC1MZW5ndGg6IDMyODMyDQpDb25uZWN0aW9uOiBjbG9zZQ0KTGFzdC1Nb2RpZmllZDogVGh1LCAyOCBKdWwgMjAyMiAwMzoxNTo1MCBHTVQNCkVUYWc6ICI4MDQwLTVlNGQ0ZjM1NmRjYjAiDQpBY2Nlc3MtQ29udHJvbC1BbGxvdy1PcmlnaW46IGh0dHBzOi8vd3d3Lml0cy5hYy5pZA0KQWNjZXNzLUNvbnRyb2wtQWxsb3ctTWV0aG9kczogR0VULCBQT1NULCBPUFRJT05TLCBERUxFVEUsIFBVVA0KQWNjZXNzLUNvbnRyb2wtQWxsb3ctQ3JlZGVudGlhbHM6IHRydWUNCkFjY2Vzcy1Db250cm9sLUFsbG93LUhlYWRlcnM6IFVzZXItQWdlbnQsS2VlcC1BbGl2ZSxDb250ZW50LVR5cGUNCkFjY2VwdC1SYW5nZXM6IGJ5dGVzDQoNCndPRjJPVFRPAACAQAAMAAAAAP8QAAB/6wABAAAAAAAAAAAAAAAAAAAAAAAAAAAAAA2CgU0b6zQcvAY/TElOT1oGYACLIgE2AiQDkSwEBgW0KAcgGzb+J5ibWiuC322DGbjyK+t5UDDdHC+3o+3xqzg5M1BLilqE7P//z0o6ZAxGbcCvWmWmRiimo1U2JIkYHlJkorHY6scGZ0Eymg9Y8Oom3U6ol2W6tlk5jbKk2vjO4rTRlu6j9asSpD/A9nv/6hjtumd3fc8fOiR0SpCEf0IGxvbafFXtVb6qq/xRSBKS9JArMi+hlJ2XykqWxYpIQDGtZWlENCJaymjUlEuXRoomWkeHv6Od+7D9Wt18vmvcgNZzGY5VtZcbvecLzBLBOoKEn1Pl7s99EzL+Dtw4A1d0cQvmkywC4xY+qua8mkNrzkqihIUudr79TUXRKuoRSqA0Ov7z/Nr+1z73TsAMMAwDDNlGYiGOYGACHyzMh2JiRX6lrcIqLLKMhtYm62IEy5ZZWjtHqUrhcXSJxnukxKLQ/zBAc/u/23a77W5rNhasYFSPjCFRA2SjRFoQZFTZRPuegCjoQ5/QZiNWgPYrvvjCjJtO/dP/z/nNnc7tdk73iye7uWdkzZ55VdBCi0fwKMFuUAluJYZYCAkEtZr5SSdLxdp2rodHDGIQA2BkbohLInoojMRYt9DSzTHzQ6eVw7X3qbtO5UacwlbYeWPqBmkA2ZKGU8CH2+o7RmaGxpBeDusz7fvyxMUuwVHDQu2tQWvmHGSPKbDZEN6F2Zh/ZV5XVagqXeNqbKH+f7/+reo+d9584CAvT6AYNLMysWxFjI39wNv/f962/t96/nP8f3P/HmOwP510VxmujSmBKSIYUdoWBAMommloxYJsGSIXQwKVUAoqCCiNKCWiucVWEMyoSIsRMyrt3MdV/8IG220aSuPc9t/mWmyCYdpvmXg34loxDeLVjwXxYDnkV3zgnAcc8NlPtIh+ddj1bdcoeDGfC/ra5uKOfH6E2E1WA5gqix5WQKKhU/1ecqPdrCUUQoPRKI3RGI///7y/+f/P2H8t/mCPwfif8zcjjzu4NwWuDRtgrdhTbJhCSjMYTedqFInRjjUFUw1p3dqxNNSgFBXBAlItV8W5j+uSx4nXK7SUeIQrU620Z0kcgbM7ssBbvvPkvYvPRtkbl+8OsMQaQFosIBZ2ATrIgSB5BywklQgeVRB5zpm3BliQKnDFkwHP4ixBOQt56p3NvI30QeSC5MMPQ++ziz6Ikn+/d4rSdANaXECQ/W/FPlkZa7K+8JO6ZKPSsBbhAlY/XmfZ+u8ckS/E3UF1RZdwiV1jP3n27+z4WwGSFWIfg2xZkleGMNRpgToALFOmaBrbAar2umvD80/7pXYTocJC6ey5i/ND+CalnyIp8qpCFh6+m35HR/DFUxwbLMA1KFxTMMI0Ae95fu2dIfvYEMrZlhohYp3/U1+WajfHs2N6Y5AAAbJNnJsLcNreMlRr2bi53yvtTt9pTDGeDAkkMHfbNpFE/d09rIUFkVAkC1IkO7Gq2skQ79dQRVGEpgjBZI0RQgghhBDGhNDUPne/2Tx+QJGxM3GJRtpvH3pk1e3ro6XLBWq59UZbA4l6XUzzJzZ/chTNn6b5szZ/vjYfZa3/krYVH33Zc7NAPPZ3w/yOsmV+5z/mA/OVi/+jkQFBB/pY4EovBuAtXLJsJarVa3TIGVEuuO2xVNk+KPBThTYlZKidzna1n16O0t9Jhhjqcte53SNGeM7bPjXBdN/4wR/+stbGiJky6tilS/pkUIYmINMSnNAsysqsz74cT1jO5Wbu5HGSk5NvKU55/qQ57dXilDWtfd3ap8Pq36BO79wu6Ybu7P6eaHivNLaP+rwJTWl237Wkf2suL1hEUzeFlVBeVVGSAWgxYSNKgQodSARMYuQpU6cHTIUuYw5c4JoyWOyEiJGgAoUqkGnUqd+kBZsOlLRNWrYvbcupK09ecVY8ffHuiJPOGzdn5cDpz37BS1z1Wocce/r5L3HF6x56pevc9A53ZUmz8ghILjBc9PHZ5ppviWVXWWvomAnT5ltkqRXW3nyVtTbcZuddb9+toaLNFCtTLZYxa86CxcrXaDk9T+Hi5arXDYisUqdJ+4R5I2JPkDRFWBQUCFjwEqdGGwIGBTchYuRpM4Ojx4a7AsOzEdNCaUUbFbToMGrSqj0pBRUDRizYl7Th3KuvWre8HzrW6VdCokUnXeS4iRyPW85lInPIg8nABq0geObS82PHuUWDzE/y3EPXnoBaskaRtFQK++P8lUxIkKvxalVs3MLkkLGvxMMJd7+Fo+6vnRXpomo4TB4/wKvrNL8kZgFfpEz4IpVAQp3M+TUpvluyytFNhbHxZIQFojPnRY7FpS69lWuhxbiD98LIdm8239VDo6PEIgpJNg7rnlvx5/5AkelCVn+oomujrUDArlDEXHU7M3qAsY8F+S5kbOjjprENeI2ukaP7Q4HLrZyrsTby5LLqiL0dvR6OogsgYh3qIrlnZPA1dW0O0rMcnyJ1v/c3Al6SFSlqaVoz7zqo+tN8p5D88TcXudPTjEb8Jy6Bmst23A6rW0/th2x1wut4khOSKSQWquuA8joBK1WV1W92hfIs+0+gci3DLJfa14412z47j1Z1yMY+hH0tMATrEOBEkv3IbOMRbEdhQ8FxP59kaC8ujUhUN38WmUGwL/o5PBt+2xT7/17REY2JiXTsgPbr2tGEOLNQReOkb35x368W3BL4aSJButLdHrzVOMpLsfe4J0zakn/wln+kh3w3vmmNOb/gnRupHyzC7wbZVYrD6U1sdoTMJVTyHykDTw4F+RCHt3tZ2Ev5B6RSDjvd8USJmR3nFgfW1sJXrr8miWnCgF6nB/n+QOmbfEmPrABi6LF7/VkY8QcTc/Vl5qpwRwrWNex42Ch5wCCOuqSltPlBT8cetYXAJhxEtM/XNuths7eQlPcIy3+whL4ifyJmZYN/7QACvAb0o/nz7dHkXqQtsvTCErMh9trAN4KI7wboG1YDgw6lSd853a6ANTpjX036D+D2HzRmXwrA3iEBW9u+/ZwqsoCnWHnfu6/ateEifuJo+4m1Zf+cUdi82Kf5OuUYvB3f601PsuIdx3FIpOnQa2hM8BiK7W6ArvTc2lr1cHscN+EVNJpk4CImknjstds025wk3KYqAgEFHAjT7bqCbs1GVsHqYH+vokxCUj45bdVm+ptzGlzZ1fxD9LktOcpc6gLtymi19P4EWaO5HiubYbACWKHkdyNEo7zMEGcXbHC3L+edt0xbcEPAe1gIXtnaXpOHF46VzEPsSHwHDxfDctviGSP5C5S/4ZJR0N5X+NbNc/4sLWG9ydrbdhk1tPfPxAnwei1GjYhAu3o5uzfJniF6kuMZCQWY2rEF+BENpg8UlvjCOYwUFcc10u9tVnjBIgLJw6DWP2YP8rwKrObdAKSrX2f8BSoLN0Dg5GSY8axyLngM3oCvUXo8hed4GS931tY6nC9RQOffm5/wkR5v8tNoyeWtNOTxSkD8ca2TzQX/blL7sa29fGShDD/rl41OXcqAyneFFr9BSRrboEddVtrDgLlH6PRk4yTzeeacV8xFutOR2t7bHoiYE3t89ukVp21FQO4b3KBsyCqxfObj2MIGvh+UXGkBZun5WbwuxlEHiHKu99GRU/qnE5z2jtLSNvrjsP75P/xMcgjyqcC44SIeDBc3lGPREw+GrWzwI4wlj3B9eH/cM3FIy9GuOBkQb55nEBgoNom9C7WT4LeQ6pdNbXZBxiHe5fkdOQ+dn+M7+XZ/8Nj4Z/+P//8ePi29jbd/u/fhfg0SpsohUxOYRpyquTvezvTmmBOu2Dx0ocvd3TXufse7MPNP9xzzbbzqbjvvwq5mR6/1F9TOnrtA5XYcxntbrFa7YZpPERGcqQfAoEPhmHC41VlhCIuESY4hBGWa9Bhz463InVdDAlNSSlpSuQaDxkzZco8s5PUYNGbOqm3nMpat23Xh2Z83Ud08pJuP88tHdBzYXU8ILG6CCEc8RNjQB9zLZ36/dsg/7Bq9vFAS6w4HTxm/ury9rKSCoL/KSCfv2T1bdNFXtD5TndOWU5RNtEdFvzlvE0gY3McZQ93j53wlXF/wpaunPu9oLWsk52zMYqS3M4EWRrVV13AivNkFbgi/Dhy8fzVr0xtyEh6LVOQEAuu/oKZlqaVt9RzA9se6DxweH7Yfbx1EPxfNfnMcHvytOo3MTcrVpog/6Gvmh0GjVvj6bYEvhTYeOw/ypy8C2l5KZ6vkOJqjQYlh7r/5xoYPnKgraSqtIwfxJwmFx9ATWhTd1tDAtSofAjoczzWB9a1ZY9NsDpQgQgwFGG2qRCjBQhSpOArjelcIAgjAfpM0vE+wb+a5O7duXL1Ztj0xGGtD/IFS5FTHMRvCYwc8fEJt503g4IKlr7IshaHcmhzuxQjV3tCg1kOx4k6DtfFFc6++9IFddwLEC0+fMv7LkpFWs3mC23Csa3qwL7VAJ9Z2U5wA1koCsXyIrCcIuBgwQcvfEEyvIduIDQNFKml7waOZq895/DZKKBLh9BFjwZ3NfPK65fTbV6aO5boNCtu9x7PveIy41VCt95nGvDof+JAdhyuAId9C32p5dH/OzlPchfO/nJ4a02R0iLWp3HH6xM68PYmhgb57Aiy504ETAM28pdER0Sn64UFT10BnS1wJjlm+v8Ja0rhGcLxo8fq0ptKwVtF2DNLx/EbwhtyLM7R8b0lTE6eVvW4LzIHnRnQpfBItUjEVlchu2cD+bMnXU4cDO7CTpJxn9aR7xOkE0Oyl0rw8YcrEa+dBrrgB0r4/K/JMEm2zrLXZvTTRrPCJneCEJ+5Cv9Ad9OLDvx7tJ8v0uXOhdlEh251k38TJpiMRkj5daez5G1Mf+qAuAwE+v1i0slcRZkZP26XaDsVw0DIAMpzgXb4ro0AnaTpLx5/rumUGArbQoQK/9mBxYaDtjsLnRnb/cosViZhJjBhfT4btrdt/X9obGHifngoWJvnCLpOuXwB0Lozp3X/EL9NL9NdLoRWpzaV18NvsPOWykLwybXRVf7zkzSB21sEjmVZ4uOr73wIxji0BW1lXzBlAP9wpBhQPYkq12Pslt0s0qLwHM1TPEMgMQcLSa81NR/4baVTNlXvf89rkJv1TQOdJYeqf+hLkGTFMajnG7N/dbOiA3xzIzpDe/1Ev05mgPMIJZTFxsBCJeKwEyicsTMt02Edggpi1PWDLjTBYEuRjVvRofCRhMYBIwqtu7KTfEmNFcHZc6YZUyaz2tCBTV9gG6zadur1TomeehnLjNNlVwrfja3euxRccMOIkMdOcTq2r3rgR0OaF7RmJdHL209iVDWn74IeJHV1Z5F13WpSi07ZByDa+AfSNRS/fXzGiUxD683greumvbR2PAfhmdhUVNBE9+90gq6MlxDoJkhuhhHaVWX2DxusfjIHEI7eNGIllvIDFfUB43+yuTQhg9/HqmxVLr/xxalIwrOqNcGWCXwF/P6792djDby7jV50iNyJsIn5nzE+kIZ3MOLpIY1IqZvbHVxdevPiZOGZhVGt1DQeAf9w2WmnBWtn2dCRiyjM6EVpZ/pI373ckG8hffSQZZTzCB5qGQ//4FBmLpxT3QDGJIcNIZl+kqmlgAypIQxx3yZaPBN2c5aShzMMAKCuhvgva/2CgLuI38wT9RiPYBJqmkfqsfoS0SvMn1PQ4W4ciQi5/UUcxqDaXbDkJg7s5tdQzYanHel9mmPlIPhE4S+uYcmcUIB8CtmIigGssWln1CpGc42ZdwxipWZh6y5LRrKxIuSi4r+QAuq8TxaxIojik38FGAtDOJ0zZjLjp8ghekiAs/JaWaSL9AmOdzuTT2ARQeT2KCUX85RuSIv4OPEIDx8T/WlAyvWFXs74Xa8cm5CP2Fm4YuIvBCeH5ZfFYhOUMNSRgQBUQZq6bAINFIvb34SN4RcUMYDv2DmgFcRwEXsuTiM7G6WwsPcQUqL3KVsRJEHqxEWUkdixFkk6L9Eu27AvRFrTRch3W0kZ6iowhoXdhembCU1CrgFzV2biQbfpe3VD233QmCpY6qaJF+kZUkaDc1rmfQOUt6KNlOgKkj2DJko69pJWtSgeREH6/E8GB+zhV08B5q7osd31yz44RC1mma27n3E/a+cGIVPZp3FMsgw6Q/Ma7cYCE/iIrxCzhIY+jWdISEKFnsVcUfTETZYROi/Spik7C5EOR/QQWI1xNi9J/9ONOtLk/LqYsdUSp2XRGFJ5LBUR5/AcKaJvscrRaMeq0QZtNdRe/nFxqM6oeMo/yj/SVERfIHRdaD7V+ViAFLhDMAGB/VOmEfzD9R1TSngUubhM4oOjbkZbSoy9p+m77Hd3dkPOx4ag8jzjZ66WSwCw7WlLJbrzDka+MAFtCMckr3F5cFh0WndI8ZjN2WrpakrRYv8L8LmsAkDZtR/RtPSBo5m743pX6sk0JShxz2WdWHGIgoGNjxERLoLzKYi/h1WJE/P+ksnbVokj5NKAHyVnMz03T9aobJTvUgX8f0Kf9EuZ3qXjuUayWGyGmNxzpt5IYus4a5mVmmT7u8PRkLZ76YAcc+PAAvdffRB88Tu691poEXLRweQqb6cbqPOACMru4XgWtEUxN/dDcdOzoVaCSmPSPROs4xl3j+wBS8uqMkmzosmIES9dFY1zAzGEuw4GnRJNgQAauB+NVTC97RAF/KA0OCJPE4MW6Pjv2pL/VUO8vBl5+9p5uxtwayJrR0Jft0fqWjm/0C7nk1o22Uk3lR38Bvhi7r/7e81+f33uuzawjxQcODPSOjMmGszJlUSE4ZqwEhfXHSRRnVwLQsn5f+TYU70uNJiCs5bpVYWAVOIka9zmc9DRG28sPJ+jJcp4Sus9d0QNofRhLyVYVobU7Ad/GovQkWZTtEnsUdG1IwPqFgvyDB/v7h4akuzIzpdIQrLPVcTjlRaHZmLmFPXMHjcsAjvQ8hkNaqKwFfT69c9J6KbtS0OsSaodlXYBIm1F61trq5RHwxVktAyKJhtjRWIQntEzfTE+msVWy2cYRaqU/03n0RLYy+CR7wyzFq8xyM+QTLgthIexslwj1gZ4NJP3iUGnZ2fhWqb9nji4s2IF0TjzS2QqGn5YS2ZGrZJHAusCq49Yj9qbzhYuZ3f4bINahnsCOu1tcQXvFF7T/EL6ik+ADfEangnfoDPgE4Shs4QKKPooz8Brd2HALPqK7N+E9SjuEU3AevQHx6C0oQ+9AEnofvEWfitvoW1CIikAxKgYpUQmIg2eoNChA3w9wGlUEEah6h7uQjJrEJdRygOcY41GESRhKMG2GN5gO4T68gFeYHo9ETAUeYIbiBmZ8DJGYQ5AGsXAdc97h/3AH67ohA+u98A3rH0RhAw8jHfMJ7mGjimh4jPkCJGB+AJmY/w5PsYmn8ASbH9zEFhaXsaXiJbYc4BG2YsNFbN0BHmLbwFVs+0IptucwsrDjO2RjYeAcxGDhIgeLBGFY1EIedl7kYhdPIB97sMdZ7MXCNSxhDwLLhLkFBA5dGOlE490bm3ROcE4nN9XlOBFn2p7d2Mj+XtPWuVW/+W3rM7cW189aW901XN+tZ3sSoqDiNZIxjGJ8kbLjjjwVBI6ZYXEwLddnwqIn9pOX5imF7M12hrKWvayVp7JlFC9n1WtQRlWqWZPOtL/TvdXvcUx24BiTnI2ZTXm6u9TOvPvZG13QRbhuMxa+Wfc/fzjIUOPe8H57bd6897Kdte/L5/UVfRuzLLk3Y/4r51036J6sPZ8vkD2SQGqIjRiQBHJ21d9P+H7lD6YfQn+w/zjwR68fI3588tOMnx7/9FX4X7BPy+CWCS03t7S3/KtV81ZurTq2mthqVquQVodaHW11rdVjqUl3OVYellflY/lfcbx5sHmM2d+caE43nzffMb80G5L/tfS2rLBcsDyy6L5btMUU9JTMcgzMaBLFUAOaoQ9m4CxM4VrVcSbeWn3r+eZMFBJjLa71t7lG9HDS6VH9NPKQ4xqsxhVs4RTPJCUVqSiTqmmG5qnJPGYszpxxNtdyD0/wSR7wRZgUSI7UyoDMS0vOChW5Tk3RHG1Ts07rFZ0N3vguvzzSRtuYtH8Wmk1tGVZvb63Vp7vE1Z7mLX50Wkvz0zbvh6GcKuvhF+rIisowLVwBFVjBKz9rap1Y3c3fGfvh/o4gqe01vtaDnSd2uLuDb5iHPOwx49AVraYSYhN7YXnsMU+71du067987MLLG3etjdz7yI6MaDqBp/uM5N9JhpxNTWpzPGkKtxRD2Tfwxt3ZF6JpuukFvZWHv8kXfg5TYSjG+b4/4Ku+WF/6C9kiq7Hj2PPsEPctx3Jf3LMBrz0Ie4GX+E7+Kj/ncXegh9AolHqSj6goiH1i22lLl1Kj1CMtD/pj0HONI0s0ZY2q8dcEaI6IdeJJ8XH5qiyx7+CJwdskdZJ2yQvl31mx1xZpmbRFOiQ9pl7W2nlL3gtsyb5lE3lS7pH/KTaKXwWoKCudyppSVr4qa8qVqqAaAAAUAQ8OwQwCUIANMAmbcAoNWIAb2EMKdEE1pKEeMtEVHfEGf+J/PMJdvMEPIvkgm6RHYmRK2lRJn2mG5qhAbbpDL/TGbtgO67MAm6DWSq3UVqlvzpfz7fJd5BunPtp6sbW+LapN7NfoF+S3yG+93wGNXfOozXuK8Z/sH+K/0v+mMCEcaa9qb2z3ntt5De/mE/xuR/gF6uQHFAKEADnAq++9QzPa9xUyUkMuRTB3IxCPElOv6ojI7OGsI1EIglg+L0VEPLBw4i5xdCN2P4n6mRz6XemqhaavPL7LztOcSjAqkRNictQxpS5ZhdlbRz31G8ghD92HcqidXvmXYXs9oZ/2gucQg3627KWX10j19/Q2XaIq7SPveQJdERjk+d2F1O7iFyLP7YugYKNXtkFGwECNCxCQEASK2w1P7Q9OFsVRYFpc+whXcap/ZQVeR3fNqejOGF9OTBwnlOwqwFcNsiHL+T16ED2+3SP/52+YQ6mCpk7ts8eSzt4ntt18rW6hQOxO3Mye0VPvEuzzX1+jtPjP0budxC3mQmRtK+qL16sEotvzW9JSt84N238Unql3aJrO8eCDe4itXvLzgVaBW400qHFTJrfERhvwOSla3L/A05FLu8IxW4OjLxNxOOd8Ccn+iDbEHgTtO+DgArwbKYqVCXzNtNlCpRecHGhdPLs4ePp7Ai+sMVN/leyKwyLeakwcNnPnjlln/aLY0aESER9KMAB3VB++x332PNxuOiOBqcOIPCk9qCOcYFS1DfUcRVA8sWrHgV12u/1SORaRN1M0mDGZIwBOSCMyZg+iEV8jCWJht6L3Oqd+sb+POvs/4REvBBP8+J1/3sRDUYRoSOHgH3GByEWUA5wJEhtPtF+ItKu7+QHIzgcVctO8EHOyf1Yb959IMRwGYXSmO79qcIGyBAlQzwjaNJAmvYpHbH2Irg+xteH8Kr/uacwgMmWS7Fi6iUqf6kOkY08/AfmKUE5s/x4oJFuXXhBRpsbrsSEMYncYfxSfOUnQijaMabFFekgaqShObAw4AahVWASj99gH5r/LNOmaAnM3WNjhfCZEimA9/ydRgpcfYsaqIaXSvXwz9IgzoWVz2VSN58a80h284ZwDFROgK4X3Cgw19KDTkiW8I61hhVVlOIml4D0OglgGVnZwu71/63ekGuBUPzRi6dmrNLYEGuACPDcSmABCj8eLuEhJRKZW8S7sCQXgVs4rxHOTKGC33HRUEmgK8QAMihFKXxaOLH8QAOj5gMSCazuRqM+aAbzO3v52auiIr6ow0jNALdow1kJzsnW6EyBVwLMlz415ja2tx7LrsUoKWmeQ3UZ2HbZahVmox3XVcnXR+KBU6TFiesB3Y2f2LM2yEH6y1vHI48dB8sEGhCuwPDPj6pB9JLmFaLjVcnbvewGgjlWET+4/xzPI/GyqdvbwYNchX/mx8AAyNCjQCft5rp2nFrewx2A669Q5paZgYdIboVZ6rU0nsmInHFFPd4KEeV5KFgQiZ8OCOjZyJIsxgMe0RT/mX5rjjTC7C1oTUBW22DcGO9neBEVoPMQpoIOnV76ahreqw3t7TB37v4kz+qeSSetZ2qDDz0YB9YEP3mWEwkaQA62XLinITyQ8N+YFRmowEGLsQDEMVEGKJPO8/NSz5UXJsC8mj/9y/CT7OT+4aDSbkmk1hohMmOplL43qE+a1nSP+LQ8IEXQTNBg3+9eJZGaUtiDjZIt1vG4Gf1WzSv1uX5rZ0lnAMW00PGWnV+Q1wfxkRslLrL+Npd5i7QZxKnAIALEvCO5nzAMqU3Nl4RYWTde2hu7eOG3yVxbxOX5cz8WAaML6EWLEmyr9+X0UjAe19Xl3QgQeRiZjjgVOxOENLUST0/uDBhMQTxagPP1OYfe/DjL/rZmXH83E4g2Fw9JcL5k4VTgk997qE+rmHWGefYVmH6jByA3nb0ksudLajaaX7+j/TPIbvlC/dOTRkWXxCExcUdX/2eisFgCNeqyZW1e6T//DgR98TEIJakU0MX7oXjdIvswsK6/HnKa+QngGi1XsKMw7w9wNEKkIH14oIE5MuYxnP2YxFHXhcXSOOHFqcCpIu7/wqhq4EMkwMoSyVX4hwt/upcpqqnAp6jc5tq0Aan7TZ8BF0X+whgiU451dUkEjW4xG4Rr+Lcwpj2ysaa+6wns9oX9wD6x+ZC8basV/Yi0iUA6qLhi4Xdbj05CBv8eCK8xvYXQ3WpkB41wuH52+Hg9eh1NtidvJo3WkGdB07eJq29Qx35Vc9QG/CKUynvjP9gyKi8raI1gbygLmLQdrlgsOHtosEI5utOd5JKKP/A8IaGdcvX6NVlU0XWXy31e+oGHbqeJac3UICgMeYCDwQ4Cw7uhTpVvCJU0aJAIsYaMMZAAbb58lwVfIz2f9gk4tSfHIU1hiEVjwQS5ETSOILeC4zt7L86sMbY0DVa3kDlTUW4+fw27Sj6wLNfpBErQlK6EOOC26dHCkv89Atuhz13Wq5nwBaDWjf/nCKyS9q+vKiXvLo/XqSMwDpamPkaw6Ml6Z9xbLvY2pwiybDEZr0CeSbErqaQy1dWHoVjkxJZilkFdOudQ3Zb6objAcOf54LcICbOhoXtLeraIswYsMGBa+D5MBF0BFtXLUiMaHm6U+3w5a3NuymB1DLvHG+GjTaRh0kBwenGLXXZlkfzeWfTY2kxn3kqbssTZQS5w748vsPJ2+g2kA9MAlz40BmCf8RXAe04STnP4FkpR0FBriYQctrerEeCbDgZAP4hHMlI0O1Z/xgTEA7fcqZ5kaVMq+v+SVBR6Aj8YbfM9DYTWqBiCOpwW8YxYiJ/sbqoyxODByGKmZxiPdWaCz6iZK6MLCZaNulpJ1wJFZqmfcKdTNensaAl/KXLMNrVvoyUR1COPofJlFsO1qsFUbxnPsPD1+B8u8A9pyMBT+37Uov/xpfA7H6SsRSlBPQQFSl5tkH/Cnq6arXohMesEPD2iG/TQ64p8WjnV5L1sBsD3NrB1gWS1YrsMYtAEGkWIISBKlUpQSK2slCjyBsdivBIz4jC7/ZauvbXz7N5LjiTXbTUSTk0BiJS7CGfgKEBwAwhpefuEAp7gnEQO8xF6Gekq+NuatbncYrAMTLuCqjpJPt/OOlwD6MB4kTeX5oI3kV/OoQiRTpWuVYe5GGMtPahgkLAppNnKU1uuj1FEiLgNu0RCIzJVlHiLFbSl961vh3t8OIMOynAL4WTtPZ7KVX8g0wuhX6noceVgCTuIpkQXTEulogw4iI4Zc5uVRhEawY9RjF2DZRXxdJDCdMAx7M26TpjmGbU/G8ZV7UW6UljtL8EbBWRzMnhrqqYPjldILzt8GFM/k8C+FOMU/9fG4s1lJ1GajwOB6y5bKX53XvUF6PLUBxUTgeJ/yKF/ikKAjbksp9bzsxOvzgKna7pxhxYu8plgHc1k3F1GZBam/voNIPj6QrEpNSapFqZb+nzmF0UvGfI3sqAv7QeDDpjJR2leKMj9tjR/4Xa+0neR/5r4ZbXXIGl1VNihuITKtuanEp4hoEbEcAc+icM81StZ9805l3QIH+QAKl3qHE/SI4Yuytz8zrWHNezJ+oQC4HjqMTWUIEyo+RR7mQicSOfIq4r7SdAgEDDTjH5Scen9ASqKUndfZjQUz1wJQ3Apxp6tkOY4xLLM9D/j22QQsfIudd4hujpZ8oQQhJEGFzK0ZItHo8cczuiHrw7ofVdc2gz+ln6c5nkeeSXZXxOlGAc/Y0T3yZMXNO+cQX/b44GosBt2tfuqgmjFOKoVH476TRo6fgWcPyIU5RdmFWSSADs9Fp7CF/sq3ny6FVzPCxCmFKdoUMoMGKWz3lROFtZOqBD/wl0ivEHwhfpptXcsRM8RCFdmoi+rNugpbiKb0a/iWWOC6k4lqUYh0a2lEdWcpCv0Rz/IHpq0SiGov+cWcN7h56ce3riqjK5dmCZpr2aCL6pRLRHgmdkv23OULVXj784vo3IqnuHnxlzeJUd1ukqosy9wm0dxcBJaXfde+RE7CL4tY+ZTR5m3hQMwXD+jGB+oP7dbx3oV1hHrAN+IqYMybh0nHxyUy13RgOUHkIM3Kp+X+MshLEQ/beGG4j4xwMprxFr/VMBtk886M0/o5TzDd8CXjfmyTFBGicFWS2zIewijAByfB4MHVzDVHdboRaiJyRgaymPoN/BJrjX4dKUfwd0uOjDwqFGI2nkC2iuUYk26AcdmWm8VMpM5FYkEK4j5RwDRCvVZKHUfG6IQWdURyJr5Y9YEVEYfBkQppl40ES4Yt/KvFn/h6aQpRfykPydOZKUqtVEMZz5CmHZ+HHvFBH5YpemhST3clyUMYJe8qqa3hbvrviy7DyS3ytpz5pfHKHzTmgbFYbY8NXvQ278VI3cc75Os4y0JKIj+bJFUJ4z20nD9SXDPbIxlHG21FWVnc6NPyZT+nr/qabKY8jD/srTX/rQ9/rY/iGdJ1MTA9466JXdxltJq99fTb3KbFfFKAJEreXVJby1UH5XnhET7wPb3AxzcplPlkEcXkrLv625ECwaaNcu0OPvmLHxdTGA3GMhVhcIqLfN/ucOWpoQdfkgLE0bV8e3MX5PXIv1N8l3VGbfNf7K/wmVM2h0KUDQHQ3z/h10BLzVitNNvU3AntGVrZbEDYw0f6M+zw/HnTpe1kSIU2xxobL4fhK0sGvAmnfXiPWTh1MFcPMGwQAH+4hAPKiADL2TJ3gMxNeoflVaLmupOidHiP4NmZP+bt02+DFDHCKW8VY4nvp3XWE/otlnMpjzrqMW01VckZTZBs5ULkEdyjdoWRJ+95QNfye+82wROFKWod4eHMEDVxKH9wid4NmUrUF7xnOs135TGlyKGHcGhFUI3l7vM6mTllBCV+cK4IjoVwBDnYWdohOFxrTa0RlU8vILHZXMo8lyQ3FaUasc1gHyPuqJ9eaTIXSuvEqaTH+3WYZwkhwuXvtnG9NED8M+0k38g4kS+Mi62oySC+PbW4w/05Zvjl5hHK2G4BiCMEEe99Tttkfj2dStcvHIYZ6XlZTYTnkjz8RdHoWg9wCmgHwXwegFujFjyuuThnaM6Alh2IO4F4mQekbalENEyKcfdZ95PnhbnV08yvQk8kenN+U9KCAjyMIxrs7qcNOQro1TpfE0bZB+naqIEYPRF3LuvnN9+Ib5hYtKkPDy5Y0DzKXSlvtY0PJ4a3Y/Gc1soTM3+f4uAYV3TYMlmH/56tFcb0xQVzcyJVonTM8XQDJWMGJAcJYOAwWMoIspnmxQtUt77LGrOGJcXywtDQUOk3HAgXoF/vukUzrEJ/oz0SzMUvr5Zkxc8yb3Viw0R/0zF3hi4vXrAYyr4F589rNuT6LmvGDERSJ74a5kLnXxijhyS9i7olZjzYoZeV3SP1xN/g2Vnw8rrdySH+OMJUueizp3/uGNDXz/u7PpOrqq4tnbpDOF2M4IQaMTONLre0zxDfLjvoZCgDBCIPxoDpqB9kEzIcGseuSpQd7UvBYSpfCjjt+dax2LGjR6HwrPFEEMwQMGLKGS9lIEglcdrziJyb0KfQi+bJgNtjJZ/UK2r8zMfxUS4qBTK3QhXGpsl6NHcmE89n5cUO4n5nmG0AcYeiQerGMrOReqwWRsD3WkAzbbm8uPAVRKFIrXX2Q4e3NBw19JTjujuBMb5b2dcHcekrdsfAN6y92feaKIV3MY0IPB+lomSO7aohhbs4dxEI/NruIr67vIEONyAqxGxR95VqPWyizdWL+TSGA4n8Ny0fUU/gW0S7SALHdYkDaUE0vN/5N7YWow9G5yN6s0MJLJwLMFdIwykzT2YazGJTpd2lVKqwDMy9+0RDTOWZTlH3XtUTQA70d2bRc4bQ6yYATMKWbuIDocRn8Cw+46UGp83DQe/fX7mSa93Djh0HDepo5nQdb6EWUhp4HyD0vyRW5uFjMKEJGNgvbQdBSCSR6cL4qYYgBp6kCcp6oipTqjQYhvLtNK7cF7Y/gJifBvv/CKSdeYXFMzMex42UvxnMkwYw+xbCLv9yeaBV4Nwr+NQWUH8sjbj/5BPPZjTbEgYwccFGd0dmwzOcD8Z+idP9b5vTyQ6FhysydiI+nuru6Yph4SwD/RZmrr5iUuPhO9Pvl5+IVzejCeNeq/+ww0/QGm3KilD/PXBSWMfsbkt3t4GcK17ebjTXHvvPtiKWYF7/e7Ynn+guFjRgz2ykLmfIvahTMPc0qUxd/g5Ya1AO17dgHb6xC4A1Jojg+mussI9C6s4CpK6nSmFvz0RwL6ae5AqkZblSdkJjOlKpFLSygak5uykUjC26W2kf0eBFSN2ZzgyBac2QHNeacXVqBlCn2sqV0tRQuQrBQ8HlE6yfPrhnj2N6ugMqS6nawlMkNZxwBtU2B1HUzwJf/ZfQ7V5uuxG/A22HHhihRJbZ661qGt3f27nXqvZ2UUl5FFce/pVXYRq7+NsV1/Ft3NMY5xA7T9n5v+6NWSjMGDGEjbyYYkit4AzgiD4TXccuoOEqZ3yB5BrnIYLwOwv1rVWuGVIzVuEa7dU5pVrvgwFnizXP9o8diX1+++3sM3fcDEzZc2Z9HLtwjVodBq3WqnbrkZWTRAxZ19FNzNyYXpSVy1Xpe/7TXa7DIj39PbRsd2lNPVe2yLZh8ewchQjnBrBpWd21Bpi/Jzs2v6igSEvIIH3JrzPzZSsBMaT4YJO+hfAJnmGjVa2imBRVgFisRfiaD/q1ErYXM4uBl1PWY0K0E7h4eJT/L8DROeOtbs8tcAdotgUMZQR7cuOYtD67e0taKUrRSOPQFs/eINKp14ngJ5fZKeVXFE1CrIQfNGg8/27lC2fIm6eSkyyZSKHJXFAbKuLINUguEjZ4v9EWiRVqfYzTPoJSQk6ueYCDG0C4IujozkSFBXPly3TZcA83sXbAwG1QeQDMJJ0Ug14DCogaWIQxKZL8D3XRMLyJIx0SKW7SKcvg1w3OAXXwFepNKLOlOnYX3zOwLTY9vEhlFc0xY/820xaJA8J5k3mq1z4xaIiNwn3Iwzx/eJSCJWPL1nUb6t3W56z3rQDHhZy3HZ+CVQWoLvWZawqIKAMOg83sqQbZrjF9feeKoohYfjZZ2PNNS55kFVlGZ4pS/HIKEwpSCHlLZK7T/pHGkn9APLxrtIuIY2O7zr4WikQYA/Rr2i/CaZdcMt4rgkJ+bhkyt3Fk4Vw9JQbydUUkfT48fKE02bFEDZGc7hXwzGrMKRyyWSbjH48hp2jvSDCR3h0j0X96fJO89FrC5U0lITdg3vcbPltYvDD9uo9teTe2JVrj+0jNjajj67y1vBCfg67UywIzU8P0cjJ0TH4ICz4izdq92tZWrinQ3JmZqMNUIBsMmpFL2+PLkhI5euYym/9b/UEec0Wf/Q5oFXCNqc9ct8pP2EAz+4ZKO2cmHj31eigSdSdeeI+RCzyCsPhwTT659+uW5C80MRIXYdRTPg1eVfUtbSL4DzkyOJ2oa0JEfNh1xfT/uu29+nQihY69dfWpCS9d8TLdqucduJtIub2gFkwVMshuGo7mfgYfwMDDsmpqdS87NvR0A25lHN7/cEfGd7pBBAkc4aSL0Tvmns6f5qLnqp1uf9Z1vwmW54tF6yYs2kcS9Bh3LVUXabeOBQ//16hJ/4laVF6ZQsT0mH9pIm11l1nbCXlnu9Xxri8BhqPYYJmo1DPdMNmlKUvdVX0kr7e1IabG9ihY2bNm5CgaKdESJeElAxF2HY2QsJKSUkG0aB5yWsINT8tX14oP3dGPIDeqC74EIMrZBSURFAW9HhG9nkC04b9V171vXcz92BdMvkSKaOFYleS2jK2jwLzY61FTZNYe5BNudHKwi1LZ7oQPurFypxQM9W+5VSnSWDAV3K93VqgLSh3zRgyRmLxbrgkHw2KRXvzN2WxqI7foHyLGOeJqHq7mk74g6o8HhOCwnslnP3QuGek0IdqRhGKeO1ijsCRweVqHZzPvQt4f6z89PIYS3sf9NPb8ablTFoGJhXzQjkFj/VMknZV1J6DOZubUKtg+I98xcyUaV2zyXytA+ouxQlt0iuzHRtt5mlkHiwaTAkFVqtYKzKtx5cLxUwBzzglWlbiWYXKhmsIBon7gNmOhdBOerB+EBV3h87+oQwg3oFxmQGksyx88niwPLru16EzZOJEqxbv2hdRLbuNaM1AKJdvhVLYl9q78TheuEPneOKqAfGav7qVu69AdqCBPuWQQx65hJeNBTyDuN9MEAizZtGaPs7dwQMRR6hKIZkvchit9qX36sBQ1yzE0lDVW5D2HoBa0RqdoN8CZOCXntPdE/ZwFAaGa970iqub9oBHWc9pbcpoxqUUiDFGJOwxGgBe4q2LMYX0CvaIonYCnj56nQPFjKg6gCtLWZlyNcKAacDD7TxrzOJfIFkrAC9gQCdGCTrqjpQfiWCx4zXggGv4thdIrbd6NRFWhqedjZQnvmt/gyMNWrD0V9G653M27gpLs62fpSIgx1lUq9GDyJaA4WycBqC01U3Irs1Wgst7YYCFY70sH8GOAK557tASJJSJ/VZLbMraOAp3J2K5JlSKyfRZ79bJA2YK6GUy3li9H9Tj4epYHXDy/2+BREC0fRGV4SYH5Vh/5/qMexPscy/+XE8UpFHvOY/dZB9cqVwGwH2Kj+Q5mQOVOFp6pgQwZOkNQoviPUxnIrqSekSu57x2U+p35NvY+LOtfbpNFsSCT22JVIOhyPuhaficNczJTS3PQgTf3nrsFwZ/st330gLWJkW9unn6Eg6XIaD2dGbUyYoQ9OAmZS3KtQDbfPmJExy3P+DpYMWzY/wMjV45KNA5pgZW+gVr84BcbauS51YY/P/lsisJmyKLaaWn3JzMwc74GZbtkGVI3eCBTI+TIvoV9DOBeDI45UqS3TxMFtmNhCuc5qxm9IDHLFgTw6R3nUceZ8fOnZdF9pwjME5V0SadsDTetf5BVScHtL7tvgz+oF8ogSIH5/C0pCseshYxaASnP299upeg4HLGUcxEX6tWCJ7LXkMemK56bJvKhJVSB0irzmbwTIB2XgzIi6ZkFbjIKAqJUneUbIG0vtO8+IHDoTHP9NK00Z7hzGh4/m7TzxzaTKTJoGb8g+b+aCuX0d0Sbl68uyWKBHgWvBJx4rtzsj38dtIextDA2FsY7GifNAPdBq5HXnUFjnJP7rbmGlq1u1A/RzQQYn2yyhHUOYswdaahNyeokHiTvB0iQupBEwygo6cZiZOoLXUQCSJldhpmRsNyUif+pIRJzFvda8LPzNLkCYY3OJSAIAVmpfMs0gLuXEyiibp1a97o69u1qQ2llI/7PBme4pMNWy8QSEXT5VN9yMUfkuF9Cgj0k0t6xlQ32lS39UiHmtH4SOgq43RiUkcDkKZm/SMZBuYOp1zB2wIasp3+6aZ5bexYoK1YCvNn5/qTqyP5ATFt5wb81WlBuYcL6ixZNJnwDu85RA6p5Ize8/H9iMpts4OIZg3KqDWcpztBpNvbkAnGuHl5TNQoNHG6b8wmlMRb88FZIyTov7Wiwh24rpGiRiaVEjG8Ibg8nQ72LhJdPs/NLDoXu+BALEawQHnAu6e4Gwrk7GLwhL11jwDQqHbQqs0Bn5LBQ+hlB/dsS8uKSel0cxhjaaHtMBZ/AzdS6hhNQzQW4sRpYW43FfoBc1MZTlp6bHLOQHbpTP3ip/muoq4/nbgTE+zOTia/eEXwYtLPdyoNsNdhHIs72BiVS7a+5QAf/jrX0+IZsORP4kSyK8DRCTxjG3mV3581pMlxGy8NwItgw7yI9rOxwipzNPBWdW0aUBlQZhuJRkHeqORHWER4epZAcAQEY2jFMWjwQb7G9RJuqaxjlj9ZzmE1jacwUqwZ7S07cnA+4DTMnDeS1sFBpYJhedwNfNJ2ev30QE7hGm2lTpqjgksjWTlNdi7WD5GaO9Bh6K+2CLYdYgnhjQoE6I9VXLhg3Wy3x4mCHt5wXcqOHh8x9I3Zlu0Qsi5JgvoOZUy+ePx40H8iyDHcTPzvPvMB5pcTpjMBV7Yez4V6Pf24PdkoJKHPizoMZbt9gAMNiLchKuVhX83x42TedvKb8EG0GOF1z7O5u7oJHDiRFx2Ymh6lJWJRIES/PEwvWR7CAOHlPeUd900yv4Hpxx/BSPNnJW87GsE5JSJRMJO6OGbb3mYcxuqzlxaF6r0C0FxbFzq9FYuoKB4Gx7SwL+mHzS32NVxmUfgkvYVO9zEpDGmNxBWhHIK5D3FHJ1sk8HXGxzVDvRVskuGG6VmTvajXDgkO8NEim2E4W6PG9NFFzdPX5dQmBAQrZ/pDItoksQrjJmueBB0+98oF+6RQlBoSjTDlxoAkntxB3rjROTZ+I50Gy5j5TDmZj5ao2MsEwCjJKtTV7Hl+qBIdxzy3EO52f+RWHaJROGjlEz7jwT/pK/GQyGwecGa2L6suPA6T+nbIOpxuyYWhKRnkfnSz8CIzmmXID6rRLBFAFdlnLKRg7XAy6Iesghxil7VnqmvujrQ5amFUBMiJANlZ/gKmHn332qMXahNSCVDhvU3cnwZrz4W9Xk262ENFOGsiWhgj5OUo4hjV53/MfOVbV0Em4H4Ow3NgdQakdTGNB8ukCWQ6mW9NG0k27oSNrPU0eSQWidjMQ79xla2dyMjOtfWoeJiBEkR4jQI8hBChqn0VJBESpLrlqNm0PtuA0P7rwyjlAqHy6I3ZfUGGR4A4Xhu5DvquKBkc4z9ggId8O5iLFaiCzIrpPZ6uAEPMGq+2cYeS4m0fdBtwFsTQLuC03AJ4JZbpg2+X0v92CZiKs2Wu42oj0Zhks+wKy2xr/rfaEw1Iaz0nstTWBPy0rUyarWyZSt/mwo4lzgci3KcDIWxGp4z0xH8IWmnC06mhRpkN2ntY1YRvkEwYD6r89xuns7wwZpXrVUKZ6AZYelgKZFOiSytZFgvsZMph5A5TZV8EJLJxooYOkT8zedlGdJRKUvnzCXAaicBrHTRc97SX9s53rDRHAWZCyncTLKK6fHttFe6K1Hpr3VLcmqnilH7s+ujAuiRtTJHy149eK6ja8/TmtT0zRpsCFkXXm6pLa0lqyu5zeMM9iU8/HoljRuiESj9ltNBOzNTZZ2pQw7nfnC9T1jszGIID8TSnKNgNR6y4BIKpH57DK+Qq+r1yVMjVyWBcjo0nyUJQKXGQRjVShMDOJSGaBepapj1HkvuvI+mNJ6oi1ydTwXS+2naWgTg1kG03WlPlMoXMYtvabaAdZgCCSgpeM1gJQYMOJ15uJ2826yr0vDjAsG/OsWcBgm5hFXLfRYzYkE4hK2yXTYoLT3fNNOM84UhSjSFScGgln2/CwFEtOGSKb1R8zmJydttI95HtSeyqbvhGFzXMRroWfzGzyUoCMUKca+PvSRObDtoZ+0Rl0FiXCmW7wt/VBaWWAHVQSVsHpdsp6Ko56rp3Zy7VrZqt3MSj9kp7D6DIk101ZqkipRttt8hYEtvpCoowY+ddoi20iO1aP99AqeBkZkY+e+GVncPr7VDUfgNFcmVafZHrHthex1at7ekbggezs+DbC7fJcAHK6pVNT7RKwhi0U3rIJPSx7f9JdIc6tQkluy9g6Clw8q6NULjKC4TI/cFtZ7OUKKt3qlNdzUTQ2JTiohs1YXVT/Eh2a6Q0DZrdMkTF6h8uzXvtF47PTY8++JytbvCP6plOo1B7qjZ1kjnXX0MJ0IRJtietwwqqIuzJZII4tArNoPPP26Nv5uRbnRJqksXMBKFaN95Y5OJDodYq30VomTC2rRKB1ht5v3yy/8THGmpxSUDACslIzeGpgnnSXuOIngJDFQuCKXqD/VFjd3IE3b3T9iQid23j/+G6chjgYIQsqJMcTeaVbr7He/xsbOHGqdvnEk5MzAdsxb5ZI4XJSAbigNoLpnt0MRJ273DermeLPOHBclcNLJVP54y5H5YxxDQ1EPeEPeGVhUX+lEh9d2DVl1bgXY4QEL0HuM6LFdgblPqkwfOsG3YD5OjLPhZzLkE3pldo7mMjqf3+NqcMg9jcq7LdBhjKTkCkmjTDB0rB+KUza6ZQZ2W9UVxhmkXy60cw1BdC3lWEMGEWJ7tlho0K01YINTJMNYEsUfRbnhtXsKPfVmn2e9wp7A8ApAgP38oH6hP1hIEt6RtYSJMZiImFicssJdn7McFojJMRlemn+kSLKjCfmHJt0CP9u3XfK2TsAyl59XthzYL2ZPzNH3/prwKSQCqWuGaIGN3WS5bDWujMT/V6tZtyIuRHOcQ650ZS5rt6euxFRbbahSsYinCKeuuDjDqfapig1BB1HQqyQ3HVSRoSQktFHrrZCQ6jsFwT7gWAfcdpewDssYOY0Yeaq6DsgfI0Iot8M1MzOURt3tex2RUeIWB6pT2evQhIryRZThzIloWF4rCzY88WqA5PuNKis+/whes1IbvbV3VPH7kuDcl0keJqPkDYKDGLr1B4TkVvBqBZoOV1QTmeK+vQgJ3l33FG7n9lHwnDMlm774O1vjlkNNslrtZ+UKafd8J3VN+dVjVWYjlvqA0Tm6TRIonacTbRnY0vf6EF7c2lzWTM5hUEaGYGpdIY2xBelpnIDznq/v71nYKYPJ+sbrPkRRalrpoTu8fbI2Az5RdkuRPhQC0qxa2esCDKQ5VSRcAZBazJY39P9qIotB/MHxo06c1ko/iw4XmS3mQlsvqq7Owrb8yrhgS0BzqZobGRure7HZr5ZqJRXggP92mFpPNJX3gqQDJt+YGg9Elmg/PqQjTcb0lCTxmYWGIREKTixk8mIjTKcAr0J7OvLomu9lotdJD/mOcYuYyLEFAHBCChKnUC7AdzzEdHfnJeTqsYbko9cpGBN8+x/fr6iUYQYSrbESnI8md8OAAf+AECGhZ8oH7p19x3zhbf/5KnqY6eeHJsM2IF5ffGHnDu7ZTNjHVN7IruKrahY5IgD6rVVf4rEzjSRqFkCgxYkyOKJyF4myxAXSNbcYrEzr1JnscBDJ5OTx4nIiRmbSrZBcaBx/6UrNWQjZZ9XGRrXaXbvvqst81kHA9bDJdQYjFNWap/Cg/zhWDmYcN3FtZGksWtQcKzdE3HiLJZK1eRsV9rHEa2JrExmyJUMMSWmjAciVpR6FItKZybOdszqsbD+3QwxOODd5ZXA+uJmhQTZS0EPxo/Q8sL71EIHdYBX4a0qyVwctz/Y6fENhQjkd3ZFLdwilXKJW2Q8jth3blTLsMh45b6j00spcw2Am0QtRBWvtw1xu5ObGnFO3JYjvtz9+m7C18svmgSiSzvOetNBM78Iq7JSCorb95GolHcx0GrWfNDTOh8Ab9kzDaGGnr7RTqBiJYrSiAdpjdPgvIr5ajLN2DJg4q9Elint+OgywEd9UG5n2/DNS5qktUaJGxi/LGGrErqFuIPD1PNUKarbM1HYi3nJG7sRykaB6WAm/vYeS6xHa4N/ToFURhhk+tK+yvsWrxNZ64RUIBybgahxdzpSFfAOlr8Mg11GSmVgU9ozM/kCdWUrqcFKfP/qbO19XJnQKB6a1PuEPE4cqkUIJMY69vNYTOS1PiZX0V/JNvmPMLTaM0plAxPq7ew55hkQRDcp1WBfmRtB5wd3Ge7jRN82+1OLID3yfdhk/dpONmFcYUoGN7pUdP3gZKtt0f9bVRb7baY6MwYuW95gbihp7aTkABTA1wMAMb7TOrchXj3G/oKLEU9/rtbrTTBzLx9D+KxqxT+FpzKqL+AdvVA7dpU5EqlMT5PM0li5TKA92lt2QDmJgS3nZoVwIZJVNfV3SVoGl7xwk3WqHK+TGS1TH1xaRwHnVHiBHrTdpo6c1kDI5tnSuZ+jCZBaLLabRrb2fmlhx8OcwR+C+zaY4MCcts+lZk4xzBV+TgeE8Hj6tC5hA6Gm+LcOt7yWWNyjHrL3DnSdz0x+ak51kOo/X3U5U+sw4C1OY/v2LrrfDscibN+17/IuBpk3xE+wNvisTQo8nSxDqYy0dEBuTEkRHG3QRykckfNYCZgrLZWS9VsRKtUysiyFNuujnZS5kk9SbvMo6TeTXot615SgnsfPXdhOd5yDfKiE1gOD+/FjTQ9OajahlMppACWKZ9eOkNgt3fGk9/pQeNSgmQP9SiKj7oIjn+Gt4hCVmvOJvWl66FkQE9E4vOMPw3FiGawrrqCMGnV740dtnLDgT/XGBmYA6QEda1eiU58pturfdZtwu/h3KDtRxoL2KZAiWMQXNjlY86Xw4ja7UUqfp7bce7V+gWD8iK9lmEKQQax5J4YJZWg+7JaHQ4ingg2+082gxDWreRtS4YiXD0tx0jYXMi0mpOvijGV4nqqbVAXfbQsIymAVdRfMUxNKTdjDxpnKFysdfmd3MpdI2ZVEHqBO/aEBrlDgJxgj7384cQqsdLS04RmTZ5HHRHjPCbqrChyA4boSBcRbFX/utRk/EZ+i0WmgDKP00UWMDd8BS+N6XvJpDWO2iH028YNEaR51E+Ns9R/ksQ7joBthLKQz4rIo/BWdn/gKmMjOlzGwKerADuNokF1ajLKvuZDiSFBo5v9YPZ6HQdsWxts2mJtP2KnI/iQVybxxTYLh1yzLLwiqSqUShoLi05S54mnh3EnBoJvaxizFjQTkDVAQeM20jBv+tQwj3ztY/3kE3HTwKBNJ7O46MAb3LWwjb1rvKXEadBkQ+ON2D21HnrWqH9ZfDh/x784BBE+bX1alJtZ22pqCIe0gRDxM6uEDrgC7hqVnFxXlkE2bSsrPbaXk8sIRAS8ZNYTdHdznTLj0hGFNpC8wsdI1bba0gvCThhS5LPEmdlci+YpzHCC6ACvVh68cBI2gsZI1OCBO4oOveGk5x6xt4xDIX8RN3mgJb3E0JLjNBxInrRsZCPdKR/CQu5WmwTdApPZuA5NDnFByy4ELK89ctJ6snLPEhpkJnyXdYH4osQZci2UKcUrhsT1sCGBSCXOP5+e5QU7LuZLb5bUFHqns1uBI6rbPOyrfqfi9gsEOXPkOGIAcnT1YSOX+KPDE5US2nrFkm5WlvVkEnA/TBFRzqAHNjJA5WkdGc2Tpa5zi/aEM8Jq6pRR2m7BtQ8GJ06z49ubjm4UvuEf+Rd9mm6ftUdd3cydLGocm2jXqFvzyAnvptbEdmyGhncd2G+FQPphmuRyTnS7l5s2P3x8o0Vk1uIdvTuDsy3VzBeOHs6LJIQG4okXZx3NhMuTyxkhwy0Q8YCWUkRBPnrJKjK/4MjJwBrwYBtRD65mZByF+HRcCMSrQfdvLAg11xHoXry888Ccbgz95C6Hc/JJoRru3rukqwbWrXGSYYfoV/EtkxvSLzJMIjv6bhjYW9ignSMCzCM6gIN1jYmPWCHuIs5iIySIYHigmHoiOahgvmidQ4a7F/BKeXjm/cP72M5dMtSriAshVuo122OwJ920IhqJJT+00mZiTLLP0ecPZq7w2slBTlL5mrj5/OHuH/739QS+wfaUXPtX1E+sLilkUlauA40J65+cTiPnYXaIgTtnSXtGKEc1Hm4Uk8uUfZroWfPlHc1INhBv9P4AX+F6GVRWN1KfR5HhhD9Uoow8D5uO4h494+E1y98N/+fstprVsN36Qe/vKwU0Lu2cPzpPJ55bG1/n+uVrxStJ5g9uM8IgA7yC7NQofy5+anoFnc8IDCc0v+Wz+Yl+hHwxc0jc52m0bn57LWNBHeFzg/aOWwnUO/qpYpbY9g0pjTboRjJ9J3ta2SNaZ81lIj1XZhlKkT+Sb+MwmEP0GoA9EQgPRLXOcbWea2RKaQRnxo5sCHb5mXD9DmJe8fJ9BRdHcabb7vjTIwsjvDrazBmZ3e0SEodTQdFQwzN1JD+Ufn6yywgdXlQOI0WYeAVPkExCKsh8d11o++7RhjA5bMDpXEhKyFWmTyUlYEbaxGVSv9oC3WgT7W/PAmeioNPqVgedbtF4CfMNZQD/7c3er3Wbs4bL6UDjgl5AfFlsWe2hE5HhP7RNxNPnSr9GpvAzGx1TWppJpnlrsQWtWH3xVOkbBdZYbiP4Q7H1ChGN7ORXu0bUaYNre/IxmwuczJZss/ZSeXd5B9kZcR+Y3iVoNsjrUMBMo5NoAECggd7pabiuNyP+tJ9jgWVEz98AUfdVUlqCFQ326/jS4dN7tqebfSTZ5s7xV0yMQ0/v45IlPZF1ZLBD5K/exF3jXZYLhioqzj7kH/sd/zDNngfvTBmN6S4KAqOvdrESixbvTmzq4goPttjJ8no6ZeeHqMC0+ABblrajnYzhev4Na7fl6GlYO+mCl0GerzH8kfSMslfgTbBRdjPDV+etEJHiCYFM9p2KSPAQAWfewwmZqWGp0JybUJhEmQ/nUbqF6DRubSu38uTjbPU51ujzFSrVVjY96Vvh0hQ2QmVpncxg671Mt4lwzB34KPlNSih0+hoXvnNUJSFGtwcTfzfzQ+ujCpCRuytzd+zx48kSury5ytnLeJC/CfVg59EhaNrZ654z8cNmGb+2J1tvO2WwrbOgc2/d9WDgW2sqkleiOVWXeBdeDDbhSKWAocJx9uuzk3zNL/ymCdm